{
  "catalog_revision": "alpha-2026.10",
  "display_name": "30×30 三面槽（测试）",
  "finish_options": [
    "NATURAL"
  ],
  "interface_standard_id": "generic:tslot-alpha",
  "material": {
    "alloy": "unspecified-alpha",
    "temper": "unspecified-alpha"
  },
  "profile_type_id": "generic:tslot-3030-3open@0.1",
  "schema_version": "0.1.0",
  "section": {
    "faces": [
      {
        "id": "FACE_PU",
        "interface_ids": [
          "FACE_PU.S0"
        ],
        "outward_normal_uv": [
          1,
          0
        ],
        "tangent_uv": [
          0,
          1
        ]
      },
      {
        "id": "FACE_NU",
        "interface_ids": [
          "FACE_NU.S0"
        ],
        "outward_normal_uv": [
          -1,
          0
        ],
        "tangent_uv": [
          0,
          -1
        ]
      },
      {
        "id": "FACE_PV",
        "interface_ids": [
          "FACE_PV.S0"
        ],
        "outward_normal_uv": [
          0,
          1
        ],
        "tangent_uv": [
          1,
          0
        ]
      },
      {
        "id": "FACE_NV",
        "interface_ids": [],
        "outward_normal_uv": [
          0,
          -1
        ],
        "tangent_uv": [
          -1,
          0
        ]
      }
    ],
    "geometry_hash": "sha256:b5313ef28369fdeebfb269255ec34b8f304af027acb63425f9a583258bab4431",
    "height_mm": 30,
    "interfaces": [
      {
        "center_uv_mm": [
          15.0,
          0
        ],
        "face_tangent_uv": [
          0,
          1
        ],
        "host_face_id": "FACE_PU",
        "id": "FACE_PU.S0",
        "interface_standard_id": "generic:tslot-alpha",
        "kind": "T_SLOT_RAIL",
        "lane_count": 1,
        "lane_index": 0,
        "outward_normal_uv": [
          1,
          0
        ],
        "station_domain": "FULL_MEMBER_LENGTH"
      },
      {
        "center_uv_mm": [
          -15.0,
          0
        ],
        "face_tangent_uv": [
          0,
          -1
        ],
        "host_face_id": "FACE_NU",
        "id": "FACE_NU.S0",
        "interface_standard_id": "generic:tslot-alpha",
        "kind": "T_SLOT_RAIL",
        "lane_count": 1,
        "lane_index": 0,
        "outward_normal_uv": [
          -1,
          0
        ],
        "station_domain": "FULL_MEMBER_LENGTH"
      },
      {
        "center_uv_mm": [
          0,
          15.0
        ],
        "face_tangent_uv": [
          1,
          0
        ],
        "host_face_id": "FACE_PV",
        "id": "FACE_PV.S0",
        "interface_standard_id": "generic:tslot-alpha",
        "kind": "T_SLOT_RAIL",
        "lane_count": 1,
        "lane_index": 0,
        "outward_normal_uv": [
          0,
          1
        ],
        "station_domain": "FULL_MEMBER_LENGTH"
      }
    ],
    "origin_uv_mm": [
      0,
      0
    ],
    "representations": {
      "lod0": "RECTANGULAR_ENVELOPE"
    },
    "section_id": "generic:tslot-3030-3open:section@0.1",
    "width_mm": 30
  },
  "series_id": "GENERIC:30",
  "supplier_id": "GENERIC",
  "supplier_sku": "TSLOT-3030-3open"
}
